{
  "id": "case-8541bd",
  "benchmarkVersion": "2.0.0",
  "contracts": [
    "certificate_status"
  ],
  "parties": [
    {
      "id": "org:buyer-b",
      "name": "Buyer B",
      "kind": "organisation",
      "emailDomains": [
        "buyer-b.example"
      ]
    },
    {
      "id": "org:northfield-components",
      "name": "Northfield Components",
      "kind": "organisation",
      "emailDomains": [
        "northfield-components.example"
      ]
    },
    {
      "id": "org:northfield-precision",
      "name": "Northfield Precision",
      "kind": "organisation",
      "emailDomains": [
        "northfield-precision.example"
      ]
    },
    {
      "id": "org:lakeside-labs",
      "name": "Lakeside Labs",
      "kind": "organisation",
      "emailDomains": [
        "lakeside-labs.example"
      ]
    },
    {
      "id": "org:regional-accreditation",
      "name": "Regional Accreditation Service",
      "kind": "organisation",
      "emailDomains": [
        "regional-accreditation.example"
      ]
    },
    {
      "id": "org:harbor-distribution",
      "name": "Harbor Distribution",
      "kind": "organisation",
      "emailDomains": [
        "harbor-distribution.example"
      ]
    }
  ],
  "accounts": [
    {
      "id": "acct:bb-buyer",
      "party": "org:buyer-b",
      "label": "purchasing manager"
    },
    {
      "id": "acct:bb-inbox",
      "party": "org:buyer-b",
      "label": "inbound mail ingestion"
    },
    {
      "id": "acct:nc-director",
      "party": "org:northfield-components",
      "label": "sales director"
    },
    {
      "id": "acct:nc-coordinator",
      "party": "org:northfield-components",
      "label": "sales coordinator"
    },
    {
      "id": "acct:nc-quality",
      "party": "org:northfield-components",
      "label": "quality engineer"
    },
    {
      "id": "acct:nc-integration",
      "party": "org:northfield-components",
      "label": "ERP integration"
    },
    {
      "id": "acct:np-sales",
      "party": "org:northfield-precision",
      "label": "sales manager"
    },
    {
      "id": "acct:lab-reports",
      "party": "org:lakeside-labs",
      "label": "report issuing desk"
    },
    {
      "id": "acct:acc-registry",
      "party": "org:regional-accreditation",
      "label": "accreditation registry"
    },
    {
      "id": "acct:hd-sales",
      "party": "org:harbor-distribution",
      "label": "sales desk"
    }
  ],
  "grants": [
    {
      "id": "g-bb-buyer",
      "account": "acct:bb-buyer",
      "party": "org:buyer-b",
      "scopes": [
        "submit",
        "commit"
      ]
    },
    {
      "id": "g-bb-inbox",
      "account": "acct:bb-inbox",
      "party": "org:buyer-b",
      "scopes": [
        "submit"
      ]
    },
    {
      "id": "g-nc-director",
      "account": "acct:nc-director",
      "party": "org:northfield-components",
      "scopes": [
        "submit",
        "commit"
      ]
    },
    {
      "id": "g-nc-coordinator",
      "account": "acct:nc-coordinator",
      "party": "org:northfield-components",
      "scopes": [
        "submit"
      ]
    },
    {
      "id": "g-nc-quality",
      "account": "acct:nc-quality",
      "party": "org:northfield-components",
      "scopes": [
        "submit"
      ]
    },
    {
      "id": "g-nc-integration",
      "account": "acct:nc-integration",
      "party": "org:northfield-components",
      "scopes": [
        "submit"
      ]
    },
    {
      "id": "g-np-sales",
      "account": "acct:np-sales",
      "party": "org:northfield-precision",
      "scopes": [
        "submit",
        "commit"
      ]
    },
    {
      "id": "g-lab-reports",
      "account": "acct:lab-reports",
      "party": "org:lakeside-labs",
      "scopes": [
        "submit",
        "attest"
      ]
    },
    {
      "id": "g-acc-registry",
      "account": "acct:acc-registry",
      "party": "org:regional-accreditation",
      "scopes": [
        "submit",
        "attest"
      ]
    },
    {
      "id": "g-hd-sales",
      "account": "acct:hd-sales",
      "party": "org:harbor-distribution",
      "scopes": [
        "submit"
      ]
    }
  ],
  "initialState": {
    "records": []
  },
  "materials": [
    {
      "id": "m1",
      "kind": "document",
      "from": "acct:nc-quality",
      "receivedAt": "2026-10-05T09:00:00Z",
      "text": "ISO 9001 certificate Q-5521 for Northfield Components, issued 1 October 2023, valid until 30 September 2026."
    }
  ],
  "steps": [
    {
      "id": "s1",
      "at": "2026-10-05T10:00:00Z",
      "submittedBy": "acct:nc-quality",
      "request": "Record the supplier's certificate.",
      "candidates": [
        {
          "ref": "c1",
          "target": "certificate_status",
          "recordType": "claim",
          "subject": "org:northfield-components",
          "attributedTo": "org:northfield-components",
          "actingFor": "org:northfield-components",
          "fields": {
            "certificateId": "Q-5521",
            "scope": "ISO 9001",
            "status": "valid"
          },
          "evidence": [
            {
              "material": "m1",
              "quote": "ISO 9001 certificate Q-5521 for Northfield Components"
            }
          ],
          "validity": {
            "from": "2023-10-01",
            "to": null
          },
          "audience": null,
          "supersedes": null,
          "withdraws": null,
          "confirmedBy": null
        }
      ]
    }
  ],
  "reads": [
    {
      "id": "q1",
      "viewer": "acct:bb-buyer",
      "subject": "org:northfield-components",
      "target": "certificate_status",
      "match": {
        "certificateId": "Q-5521"
      },
      "asOf": "2026-09-15",
      "knownAt": "2026-10-06T23:59:59Z"
    },
    {
      "id": "q2",
      "viewer": "acct:bb-buyer",
      "subject": "org:northfield-components",
      "target": "certificate_status",
      "match": {
        "certificateId": "Q-5521"
      },
      "asOf": "2026-10-06",
      "knownAt": "2026-10-06T23:59:59Z"
    }
  ]
}
