{
  "id": "case-374316",
  "benchmarkVersion": "2.0.0",
  "contracts": [
    "lead_time"
  ],
  "parties": [
    {
      "id": "org:buyer-b",
      "name": "Buyer B",
      "kind": "organisation",
      "emailDomains": [
        "buyer-b.example"
      ]
    },
    {
      "id": "org:northfield-components",
      "name": "Northfield Components",
      "kind": "organisation",
      "emailDomains": [
        "northfield-components.example"
      ]
    },
    {
      "id": "org:northfield-precision",
      "name": "Northfield Precision",
      "kind": "organisation",
      "emailDomains": [
        "northfield-precision.example"
      ]
    },
    {
      "id": "org:lakeside-labs",
      "name": "Lakeside Labs",
      "kind": "organisation",
      "emailDomains": [
        "lakeside-labs.example"
      ]
    },
    {
      "id": "org:regional-accreditation",
      "name": "Regional Accreditation Service",
      "kind": "organisation",
      "emailDomains": [
        "regional-accreditation.example"
      ]
    },
    {
      "id": "org:harbor-distribution",
      "name": "Harbor Distribution",
      "kind": "organisation",
      "emailDomains": [
        "harbor-distribution.example"
      ]
    }
  ],
  "accounts": [
    {
      "id": "acct:bb-buyer",
      "party": "org:buyer-b",
      "label": "purchasing manager"
    },
    {
      "id": "acct:bb-inbox",
      "party": "org:buyer-b",
      "label": "inbound mail ingestion"
    },
    {
      "id": "acct:nc-director",
      "party": "org:northfield-components",
      "label": "sales director"
    },
    {
      "id": "acct:nc-coordinator",
      "party": "org:northfield-components",
      "label": "sales coordinator"
    },
    {
      "id": "acct:nc-quality",
      "party": "org:northfield-components",
      "label": "quality engineer"
    },
    {
      "id": "acct:nc-integration",
      "party": "org:northfield-components",
      "label": "ERP integration"
    },
    {
      "id": "acct:np-sales",
      "party": "org:northfield-precision",
      "label": "sales manager"
    },
    {
      "id": "acct:lab-reports",
      "party": "org:lakeside-labs",
      "label": "report issuing desk"
    },
    {
      "id": "acct:acc-registry",
      "party": "org:regional-accreditation",
      "label": "accreditation registry"
    },
    {
      "id": "acct:hd-sales",
      "party": "org:harbor-distribution",
      "label": "sales desk"
    }
  ],
  "grants": [
    {
      "id": "g-bb-buyer",
      "account": "acct:bb-buyer",
      "party": "org:buyer-b",
      "scopes": [
        "submit",
        "commit"
      ]
    },
    {
      "id": "g-bb-inbox",
      "account": "acct:bb-inbox",
      "party": "org:buyer-b",
      "scopes": [
        "submit"
      ]
    },
    {
      "id": "g-nc-director",
      "account": "acct:nc-director",
      "party": "org:northfield-components",
      "scopes": [
        "submit",
        "commit"
      ]
    },
    {
      "id": "g-nc-coordinator",
      "account": "acct:nc-coordinator",
      "party": "org:northfield-components",
      "scopes": [
        "submit"
      ]
    },
    {
      "id": "g-nc-quality",
      "account": "acct:nc-quality",
      "party": "org:northfield-components",
      "scopes": [
        "submit"
      ]
    },
    {
      "id": "g-nc-integration",
      "account": "acct:nc-integration",
      "party": "org:northfield-components",
      "scopes": [
        "submit"
      ]
    },
    {
      "id": "g-np-sales",
      "account": "acct:np-sales",
      "party": "org:northfield-precision",
      "scopes": [
        "submit",
        "commit"
      ]
    },
    {
      "id": "g-lab-reports",
      "account": "acct:lab-reports",
      "party": "org:lakeside-labs",
      "scopes": [
        "submit",
        "attest"
      ]
    },
    {
      "id": "g-acc-registry",
      "account": "acct:acc-registry",
      "party": "org:regional-accreditation",
      "scopes": [
        "submit",
        "attest"
      ]
    },
    {
      "id": "g-hd-sales",
      "account": "acct:hd-sales",
      "party": "org:harbor-distribution",
      "scopes": [
        "submit"
      ]
    }
  ],
  "initialState": {
    "records": [
      {
        "id": "r1",
        "candidate": null,
        "step": null,
        "target": "lead_time",
        "recordType": "claim",
        "subject": "org:northfield-components",
        "attributedTo": "org:northfield-components",
        "actingFor": "org:northfield-components",
        "submittedBy": "acct:nc-director",
        "fields": {
          "product": "HX-40",
          "value": 6,
          "unit": "week"
        },
        "evidence": [
          {
            "material": "m1",
            "quote": "HX-40 lead time is six weeks"
          }
        ],
        "validity": {
          "from": "2026-10-01",
          "to": null
        },
        "recordedAt": "2026-10-01T10:00:00Z",
        "audience": null,
        "supersedes": null,
        "withdraws": null,
        "confirmedBy": null
      }
    ]
  },
  "materials": [
    {
      "id": "m1",
      "kind": "portal-message",
      "from": "acct:nc-director",
      "receivedAt": "2026-10-01T09:00:00Z",
      "text": "HX-40 lead time is six weeks."
    },
    {
      "id": "m2",
      "kind": "portal-message",
      "from": "acct:nc-director",
      "receivedAt": "2026-10-06T09:00:00Z",
      "text": "HX-60 lead time is nine weeks."
    }
  ],
  "steps": [
    {
      "id": "s1",
      "at": "2026-10-06T10:00:00Z",
      "submittedBy": "acct:nc-director",
      "request": "Record the supplier's stated lead time.",
      "candidates": [
        {
          "ref": "c1",
          "target": "lead_time",
          "recordType": "claim",
          "subject": "org:northfield-components",
          "attributedTo": "org:northfield-components",
          "actingFor": "org:northfield-components",
          "fields": {
            "product": "HX-60",
            "value": 9,
            "unit": "week"
          },
          "evidence": [
            {
              "material": "m2",
              "quote": "HX-60 lead time is nine weeks"
            }
          ],
          "validity": {
            "from": "2026-10-06",
            "to": null
          },
          "audience": null,
          "supersedes": null,
          "withdraws": null,
          "confirmedBy": null
        }
      ]
    }
  ],
  "reads": [
    {
      "id": "q1",
      "viewer": "acct:bb-buyer",
      "subject": "org:northfield-components",
      "target": "lead_time",
      "match": {
        "product": "HX-40"
      },
      "asOf": "2026-10-07",
      "knownAt": "2026-10-07T23:59:59Z"
    },
    {
      "id": "q2",
      "viewer": "acct:bb-buyer",
      "subject": "org:northfield-components",
      "target": "lead_time",
      "match": {
        "product": "HX-60"
      },
      "asOf": "2026-10-07",
      "knownAt": "2026-10-07T23:59:59Z"
    }
  ]
}
