{
  "id": "case-f2aed6",
  "benchmarkVersion": "2.0.0",
  "contracts": [
    "test_result",
    "accreditation"
  ],
  "parties": [
    {
      "id": "org:buyer-b",
      "name": "Buyer B",
      "kind": "organisation",
      "emailDomains": [
        "buyer-b.example"
      ]
    },
    {
      "id": "org:northfield-components",
      "name": "Northfield Components",
      "kind": "organisation",
      "emailDomains": [
        "northfield-components.example"
      ]
    },
    {
      "id": "org:northfield-precision",
      "name": "Northfield Precision",
      "kind": "organisation",
      "emailDomains": [
        "northfield-precision.example"
      ]
    },
    {
      "id": "org:lakeside-labs",
      "name": "Lakeside Labs",
      "kind": "organisation",
      "emailDomains": [
        "lakeside-labs.example"
      ]
    },
    {
      "id": "org:regional-accreditation",
      "name": "Regional Accreditation Service",
      "kind": "organisation",
      "emailDomains": [
        "regional-accreditation.example"
      ]
    },
    {
      "id": "org:harbor-distribution",
      "name": "Harbor Distribution",
      "kind": "organisation",
      "emailDomains": [
        "harbor-distribution.example"
      ]
    }
  ],
  "accounts": [
    {
      "id": "acct:bb-buyer",
      "party": "org:buyer-b",
      "label": "purchasing manager"
    },
    {
      "id": "acct:bb-inbox",
      "party": "org:buyer-b",
      "label": "inbound mail ingestion"
    },
    {
      "id": "acct:nc-director",
      "party": "org:northfield-components",
      "label": "sales director"
    },
    {
      "id": "acct:nc-coordinator",
      "party": "org:northfield-components",
      "label": "sales coordinator"
    },
    {
      "id": "acct:nc-quality",
      "party": "org:northfield-components",
      "label": "quality engineer"
    },
    {
      "id": "acct:nc-integration",
      "party": "org:northfield-components",
      "label": "ERP integration"
    },
    {
      "id": "acct:np-sales",
      "party": "org:northfield-precision",
      "label": "sales manager"
    },
    {
      "id": "acct:lab-reports",
      "party": "org:lakeside-labs",
      "label": "report issuing desk"
    },
    {
      "id": "acct:acc-registry",
      "party": "org:regional-accreditation",
      "label": "accreditation registry"
    },
    {
      "id": "acct:hd-sales",
      "party": "org:harbor-distribution",
      "label": "sales desk"
    }
  ],
  "grants": [
    {
      "id": "g-bb-buyer",
      "account": "acct:bb-buyer",
      "party": "org:buyer-b",
      "scopes": [
        "submit",
        "commit"
      ]
    },
    {
      "id": "g-bb-inbox",
      "account": "acct:bb-inbox",
      "party": "org:buyer-b",
      "scopes": [
        "submit"
      ]
    },
    {
      "id": "g-nc-director",
      "account": "acct:nc-director",
      "party": "org:northfield-components",
      "scopes": [
        "submit",
        "commit"
      ]
    },
    {
      "id": "g-nc-coordinator",
      "account": "acct:nc-coordinator",
      "party": "org:northfield-components",
      "scopes": [
        "submit"
      ]
    },
    {
      "id": "g-nc-quality",
      "account": "acct:nc-quality",
      "party": "org:northfield-components",
      "scopes": [
        "submit"
      ]
    },
    {
      "id": "g-nc-integration",
      "account": "acct:nc-integration",
      "party": "org:northfield-components",
      "scopes": [
        "submit"
      ]
    },
    {
      "id": "g-np-sales",
      "account": "acct:np-sales",
      "party": "org:northfield-precision",
      "scopes": [
        "submit",
        "commit"
      ]
    },
    {
      "id": "g-lab-reports",
      "account": "acct:lab-reports",
      "party": "org:lakeside-labs",
      "scopes": [
        "submit",
        "attest"
      ]
    },
    {
      "id": "g-acc-registry",
      "account": "acct:acc-registry",
      "party": "org:regional-accreditation",
      "scopes": [
        "submit",
        "attest"
      ]
    },
    {
      "id": "g-hd-sales",
      "account": "acct:hd-sales",
      "party": "org:harbor-distribution",
      "scopes": [
        "submit"
      ]
    }
  ],
  "initialState": {
    "records": [
      {
        "id": "r1",
        "candidate": null,
        "step": null,
        "target": "accreditation",
        "recordType": "issuer-attestation",
        "subject": "org:lakeside-labs",
        "attributedTo": "org:regional-accreditation",
        "actingFor": "org:regional-accreditation",
        "submittedBy": "acct:acc-registry",
        "fields": {
          "scope": "UL 94 flammability testing"
        },
        "evidence": [
          {
            "material": "m0",
            "quote": "accredited for UL 94 flammability testing"
          }
        ],
        "validity": {
          "from": "2026-01-01",
          "to": "2027-06-30"
        },
        "recordedAt": "2026-01-02T10:00:00Z",
        "audience": null,
        "supersedes": null,
        "withdraws": null,
        "confirmedBy": null
      }
    ]
  },
  "materials": [
    {
      "id": "m0",
      "kind": "document",
      "from": "acct:acc-registry",
      "receivedAt": "2026-01-02T09:00:00Z",
      "text": "Lakeside Labs is accredited for UL 94 flammability testing from 1 January 2026 to 30 June 2027."
    },
    {
      "id": "m1",
      "kind": "document",
      "from": "acct:lab-reports",
      "receivedAt": "2026-10-05T09:00:00Z",
      "text": "Report FR-118. Sample: PC-ABS 2200, supplied by Northfield Components. Result: UL 94 V-0 at 1.5 mm. Issued by Lakeside Labs."
    }
  ],
  "steps": [
    {
      "id": "s1",
      "at": "2026-10-05T10:00:00Z",
      "submittedBy": "acct:lab-reports",
      "request": "Record the issued report.",
      "candidates": [
        {
          "ref": "c1",
          "target": "test_result",
          "recordType": "issuer-attestation",
          "subject": "material:pc-abs-2200",
          "attributedTo": "org:lakeside-labs",
          "actingFor": "org:lakeside-labs",
          "fields": {
            "material": "PC-ABS 2200",
            "standard": "UL 94",
            "thicknessMm": 1.5,
            "result": "V-0",
            "reportId": "FR-118"
          },
          "evidence": [
            {
              "material": "m1",
              "quote": "Result: UL 94 V-0 at 1.5 mm"
            }
          ],
          "validity": {
            "from": "2026-10-05",
            "to": null
          },
          "audience": null,
          "supersedes": null,
          "withdraws": null,
          "confirmedBy": null
        }
      ]
    }
  ],
  "reads": [
    {
      "id": "q1",
      "viewer": "acct:bb-buyer",
      "subject": "material:pc-abs-2200",
      "target": "test_result",
      "match": {
        "material": "PC-ABS 2200",
        "standard": "UL 94",
        "thicknessMm": 1.5
      },
      "asOf": "2026-10-06",
      "knownAt": "2026-10-06T23:59:59Z"
    }
  ]
}
